"Key","Item Type","Publication Year","Author","Title","Publication Title","ISBN","ISSN","DOI","Url","Abstract Note","Date","Date Added","Date Modified","Access Date","Pages","Num Pages","Issue","Volume","Number Of Volumes","Journal Abbreviation","Short Title","Series","Series Number","Series Text","Series Title","Publisher","Place","Language","Rights","Type","Archive","Archive Location","Library Catalog","Call Number","Extra","Notes","File Attachments","Link Attachments","Manual Tags","Automatic Tags","Editor","Series Editor","Translator","Contributor","Attorney Agent","Book Author","Cast Member","Commenter","Composer","Cosponsor","Counsel","Interviewer","Producer","Recipient","Reviewed Author","Scriptwriter","Words By","Guest","Number","Edition","Running Time","Scale","Medium","Artwork Size","Filing Date","Application Number","Assignee","Issuing Authority","Country","Meeting Name","Conference Name","Court","References","Reporter","Legal Status","Priority Numbers","Programming Language","Version","System","Code","Code Number","Section","Session","Committee","History","Legislative Body"
"V4BHLIQZ","webpage","2025","Ravid, Barak","U.S. enters Israel's war against Iran","Axios","","","","https://www.axios.com/2025/06/21/us-strike-iran-nuclear-israel-trump","Trump's direct intervention marks a historic escalation in the Middle East.","2025-06-22","2025-06-24 10:04:00","2025-06-24 10:04:00","2025-06-24 10:04:00","","","","","","","","","","","","","","en","","","","","","","","","C:\Users\ttft3\Zotero\storage\3X3ZSXV3\us-strike-iran-nuclear-israel-trump.html","","","","","","","","","","","","","","","","","","","","","","","","","","","","","","","","","","","","","","","","","","","","","","","","",""
"K97B8U9T","journalArticle","2014","Zhang, Yitang","Bounded gaps between primes","Annals of Mathematics","","0003-486X","10.4007/annals.2014.179.3.7","https://annals.math.princeton.edu/2014/179-3/p07","","2014-05-01","2025-06-24 09:26:41","2025-06-24 09:26:41","2025-06-24 09:26:41","1121-1174","","3","179","","Ann. Math.","","","","","","","","en","","","","","DOI.org (Crossref)","","","","C:\Users\ttft3\Zotero\storage\USPHBBLQ\Zhang - 2014 - Bounded gaps between primes.pdf","","","","","","","","","","","","","","","","","","","","","","","","","","","","","","","","","","","","","","","","","","","","","","","","",""
"GKW4FUEH","conferencePaper","2003","Ghemawat, Sanjay; Gobioff, Howard; Leung, Shun-Tak","The Google file system","Proceedings of the nineteenth ACM symposium on Operating systems principles","978-1-58113-757-6","","10.1145/945445.945450","https://dl.acm.org/doi/10.1145/945445.945450","","2003-10-19","2025-06-24 09:24:08","2025-06-24 09:24:08","2025-06-24 09:24:08","29-43","","","","","","","","","","","ACM","Bolton Landing NY USA","en","","","","","DOI.org (Crossref)","","","","C:\Users\ttft3\Zotero\storage\UUGDSN2U\Ghemawat 等 - 2003 - The Google file system.pdf","","","","","","","","","","","","","","","","","","","","","","","","","","","","","","","","","","SOSP03: ACM Symposium on Operating Systems Principles","","","","","","","","","","","","","","",""
"UBWD9JPU","conferencePaper","2005","Wang, Xiaoyun; Yu, Hongbo","How to Break MD5 and Other Hash Functions","Advances in Cryptology – EUROCRYPT 2005","978-3-540-32055-5","","10.1007/11426639_2","","MD5 is one of the most widely used cryptographic hash functions nowadays. It was designed in 1992 as an improvement of MD4, and its security was widely studied since then by several authors. The best known result so far was a semi free-start collision, in which the initial value of the hash function is replaced by a non-standard value, which is the result of the attack. In this paper we present a new powerful attack on MD5 which allows us to find collisions efficiently. We used this attack to find collisions of MD5 in about 15 minutes up to an hour computation time. The attack is a differential attack, which unlike most differential attacks, does not use the exclusive-or as a measure of difference, but instead uses modular integer subtraction as the measure. We call this kind of differential a modular differential. An application of this attack to MD4 can find a collision in less than a fraction of a second. This attack is also applicable to other hash functions, such as RIPEMD and HAVAL.","2005","2025-06-24 09:11:01","2025-06-24 09:11:01","","19-35","","","","","","","","","","","Springer","Berlin, Heidelberg","en","","","","","Springer Link","","","","C:\Users\ttft3\Zotero\storage\HMEDC5IU\Wang和Yu - 2005 - How to Break MD5 and Other Hash Functions.pdf","","","Block Cipher; Differential Attack; Fast Software Encryption; Hash Function; Message Block","Cramer, Ronald","","","","","","","","","","","","","","","","","","","","","","","","","","","","","","","","","","","","","","","","","","","","",""
"95PLEMTM","webpage","","","贷款创造存款理论的源起、发展与应用 - 中国知网","","","","","https://kns.cnki.net/kcms2/article/abstract?v=HR7ide6_o4TrM1IymsJCPbDZc7eDf8CPnoGO9F_kJq2gy4vYe6erSfA2moldo2IGFgW9kA15kvAFgEUmJle7lT5u8RADCEouFFAQjZAP5Kq2GoTmmxPigtPpNnVRuUaN__XFZsGC-u0=&uniplatform=NZKPT&flag=copy","","","2025-06-24 09:10:25","2025-06-24 09:10:25","2025-06-24 09:10:25","","","","","","","","","","","","","","","","","","","","","","","C:\Users\ttft3\Zotero\storage\UIQEPTJV\abstract.html","","","","","","","","","","","","","","","","","","","","","","","","","","","","","","","","","","","","","","","","","","","","","","","","",""
"ZCF5V2A4","journalArticle","2008","Chang, Fay; Dean, Jeffrey; Ghemawat, Sanjay; Hsieh, Wilson C.; Wallach, Deborah A.; Burrows, Mike; Chandra, Tushar; Fikes, Andrew; Gruber, Robert E.","Bigtable: A Distributed Storage System for Structured Data","ACM Transactions on Computer Systems","","0734-2071, 1557-7333","10.1145/1365815.1365816","https://dl.acm.org/doi/10.1145/1365815.1365816","Bigtable is a distributed storage system for managing structured data that is designed to scale to a very large size: petabytes of data across thousands of commodity servers. Many projects at Google store data in Bigtable, including web indexing, Google Earth, and Google Finance. These applications place very different demands on Bigtable, both in terms of data size (from URLs to web pages to satellite imagery) and latency requirements (from backend bulk processing to real-time data serving). Despite these varied demands, Bigtable has successfully provided a ﬂexible, high-performance solution for all of these Google products. In this paper we describe the simple data model provided by Bigtable, which gives clients dynamic control over data layout and format, and we describe the design and implementation of Bigtable.","2008-06","2025-06-24 09:04:58","2025-06-24 09:04:58","2025-06-24 09:04:58","1-26","","2","26","","ACM Trans. Comput. Syst.","Bigtable","","","","","","","en","","","","","DOI.org (Crossref)","","","","C:\Users\ttft3\Zotero\storage\MPG4PNDA\Chang 等 - 2008 - Bigtable A Distributed Storage System for Structured Data.pdf","","","","","","","","","","","","","","","","","","","","","","","","","","","","","","","","","","","","","","","","","","","","","","","","",""
"P9L6UZ7L","journalArticle","2008","Dean, Jeffrey; Ghemawat, Sanjay","MapReduce: simplified data processing on large clusters","Communications of the ACM","","0001-0782, 1557-7317","10.1145/1327452.1327492","https://dl.acm.org/doi/10.1145/1327452.1327492","MapReduce is a programming model and an associated implementation for processing and generating large data sets. Users specify a map function that processes a key/value pair to generate a set of intermediate key/value pairs, and a reduce function that merges all intermediate values associated with the same intermediate key. Many real world tasks are expressible in this model, as shown in the paper.","2008-01","2025-06-24 09:03:43","2025-06-24 09:03:43","2025-06-24 09:03:43","107-113","","1","51","","Commun. ACM","MapReduce","","","","","","","en","","","","","DOI.org (Crossref)","","","","C:\Users\ttft3\Zotero\storage\SV7HTT3A\Dean和Ghemawat - 2008 - MapReduce simplified data processing on large clusters.pdf","","","","","","","","","","","","","","","","","","","","","","","","","","","","","","","","","","","","","","","","","","","","","","","","",""
"R77VYY35","webpage","","","现代汉语副词“就”字的功能视角研究 - 中国知网","","","","","https://kns.cnki.net/kcms2/article/abstract?v=HR7ide6_o4RL38Voe20h0DTIYIDMKRljv3fXTTx8Gpw4TsS3FT2F0z9L3FtSFFpHvhah6Ch3OlsV5c2OlDj0R6jZGeFSoKAaMkJQ_h8uSLE-AM4aErcSm-qCvYt-GaShBv9k6dyKwUg&uniplatform=NZKPT&flag=copy&captchaId=8ec0e100-0855-4ac8-8260-f12be83e335d","","","2025-06-24 08:59:06","2025-06-24 08:59:06","2025-06-24 08:59:06","","","","","","","","","","","","","","","","","","","","","","","C:\Users\ttft3\Zotero\storage\CM78GC5L\abstract.html","","","","","","","","","","","","","","","","","","","","","","","","","","","","","","","","","","","","","","","","","","","","","","","","",""
"7KC9SPEZ","journalArticle","","Nakamoto, Satoshi","Bitcoin: A Peer-to-Peer Electronic Cash System","","","","","","A purely peer-to-peer version of electronic cash would allow online payments to be sent directly from one party to another without going through a financial institution. Digital signatures provide part of the solution, but the main benefits are lost if a trusted third party is still required to prevent double-spending. We propose a solution to the double-spending problem using a peer-to-peer network. The network timestamps transactions by hashing them into an ongoing chain of hash-based proof-of-work, forming a record that cannot be changed without redoing the proof-of-work. The longest chain not only serves as proof of the sequence of events witnessed, but proof that it came from the largest pool of CPU power. As long as a majority of CPU power is controlled by nodes that are not cooperating to attack the network, they'll generate the longest chain and outpace attackers. The network itself requires minimal structure. Messages are broadcast on a best effort basis, and nodes can leave and rejoin the network at will, accepting the longest proof-of-work chain as proof of what happened while they were gone.","","2025-06-24 08:57:04","2025-06-24 08:57:04","","","","","","","","","","","","","","","en","","","","","Zotero","","","","C:\Users\ttft3\Zotero\storage\9KAF4SR4\Nakamoto - Bitcoin A Peer-to-Peer Electronic Cash System.pdf","","","","","","","","","","","","","","","","","","","","","","","","","","","","","","","","","","","","","","","","","","","","","","","","",""
"2GXSXUJB","preprint","2015","He, Kaiming; Zhang, Xiangyu; Ren, Shaoqing; Sun, Jian","Deep Residual Learning for Image Recognition","","","","10.48550/arXiv.1512.03385","http://arxiv.org/abs/1512.03385","Deeper neural networks are more difficult to train. We present a residual learning framework to ease the training of networks that are substantially deeper than those used previously. We explicitly reformulate the layers as learning residual functions with reference to the layer inputs, instead of learning unreferenced functions. We provide comprehensive empirical evidence showing that these residual networks are easier to optimize, and can gain accuracy from considerably increased depth. On the ImageNet dataset we evaluate residual nets with a depth of up to 152 layers---8x deeper than VGG nets but still having lower complexity. An ensemble of these residual nets achieves 3.57% error on the ImageNet test set. This result won the 1st place on the ILSVRC 2015 classification task. We also present analysis on CIFAR-10 with 100 and 1000 layers. The depth of representations is of central importance for many visual recognition tasks. Solely due to our extremely deep representations, we obtain a 28% relative improvement on the COCO object detection dataset. Deep residual nets are foundations of our submissions to ILSVRC & COCO 2015 competitions, where we also won the 1st places on the tasks of ImageNet detection, ImageNet localization, COCO detection, and COCO segmentation.","2015-12-10","2025-06-24 08:56:03","2025-06-24 08:56:03","2025-06-24 08:56:03","","","","","","","","","","","","arXiv","","","","","","","arXiv.org","","arXiv:1512.03385 [cs]","Comment: Tech report","C:\Users\ttft3\Zotero\storage\UD9K62Q6\He 等 - 2015 - Deep Residual Learning for Image Recognition.pdf; C:\Users\ttft3\Zotero\storage\8J92S53K\1512.html","","","Computer Science - Computer Vision and Pattern Recognition","","","","","","","","","","","","","","","","","","","arXiv:1512.03385","","","","","","","","","","","","","","","","","","","","","","","","","","",""
"CCZTPISQ","preprint","2016","Redmon, Joseph; Divvala, Santosh; Girshick, Ross; Farhadi, Ali","You Only Look Once: Unified, Real-Time Object Detection","","","","10.48550/arXiv.1506.02640","http://arxiv.org/abs/1506.02640","We present YOLO, a new approach to object detection. Prior work on object detection repurposes classifiers to perform detection. Instead, we frame object detection as a regression problem to spatially separated bounding boxes and associated class probabilities. A single neural network predicts bounding boxes and class probabilities directly from full images in one evaluation. Since the whole detection pipeline is a single network, it can be optimized end-to-end directly on detection performance. Our unified architecture is extremely fast. Our base YOLO model processes images in real-time at 45 frames per second. A smaller version of the network, Fast YOLO, processes an astounding 155 frames per second while still achieving double the mAP of other real-time detectors. Compared to state-of-the-art detection systems, YOLO makes more localization errors but is far less likely to predict false detections where nothing exists. Finally, YOLO learns very general representations of objects. It outperforms all other detection methods, including DPM and R-CNN, by a wide margin when generalizing from natural images to artwork on both the Picasso Dataset and the People-Art Dataset.","2016-05-09","2025-06-24 07:00:18","2025-06-24 07:00:18","2025-06-24 07:00:18","","","","","","","You Only Look Once","","","","","arXiv","","","","","","","arXiv.org","","arXiv:1506.02640 [cs]","","C:\Users\ttft3\Zotero\storage\GQX92RBD\Redmon 等 - 2016 - You Only Look Once Unified, Real-Time Object Detection.pdf; C:\Users\ttft3\Zotero\storage\MKSPJ6Q6\1506.html","","","Computer Science - Computer Vision and Pattern Recognition","","","","","","","","","","","","","","","","","","","arXiv:1506.02640","","","","","","","","","","","","","","","","","","","","","","","","","","",""
"SRIBRCWK","preprint","2023","Vaswani, Ashish; Shazeer, Noam; Parmar, Niki; Uszkoreit, Jakob; Jones, Llion; Gomez, Aidan N.; Kaiser, Lukasz; Polosukhin, Illia","Attention Is All You Need","","","","10.48550/arXiv.1706.03762","http://arxiv.org/abs/1706.03762","The dominant sequence transduction models are based on complex recurrent or convolutional neural networks in an encoder-decoder configuration. The best performing models also connect the encoder and decoder through an attention mechanism. We propose a new simple network architecture, the Transformer, based solely on attention mechanisms, dispensing with recurrence and convolutions entirely. Experiments on two machine translation tasks show these models to be superior in quality while being more parallelizable and requiring significantly less time to train. Our model achieves 28.4 BLEU on the WMT 2014 English-to-German translation task, improving over the existing best results, including ensembles by over 2 BLEU. On the WMT 2014 English-to-French translation task, our model establishes a new single-model state-of-the-art BLEU score of 41.8 after training for 3.5 days on eight GPUs, a small fraction of the training costs of the best models from the literature. We show that the Transformer generalizes well to other tasks by applying it successfully to English constituency parsing both with large and limited training data.","2023-08-02","2025-06-24 06:58:12","2025-06-24 06:58:12","2025-06-24 06:58:12","","","","","","","","","","","","arXiv","","","","","","","arXiv.org","","arXiv:1706.03762 [cs]","Comment: 15 pages, 5 figures","C:\Users\ttft3\Zotero\storage\N3LVTQGL\Vaswani 等 - 2023 - Attention Is All You Need.pdf; C:\Users\ttft3\Zotero\storage\WUN2BJ86\1706.html","","","Computer Science - Computation and Language; Computer Science - Machine Learning","","","","","","","","","","","","","","","","","","","arXiv:1706.03762","","","","","","","","","","","","","","","","","","","","","","","","","","",""
"KRNRNWWU","newspaperArticle","2025","Sandoval, Edgar; County, Pooja SalhotraReporting from Kerr; Texas","Families Wait for Word of Missing as Texas Floods Death Toll Hits 120","The New York Times","","0362-4331","","https://www.nytimes.com/2025/07/09/us/texas-floods-missing-search.html","Officials defended their actions in the hardest-hit county, where no survivors have been found since Friday. Statewide, 173 people remain unaccounted for, the governor said.","2025-07-09","2025-07-10 01:20:26","2025-07-10 01:20:26","2025-07-10 01:20:26","","","","","","","","","","","","","","en-US","","","","","NYTimes.com","","","","C:\Users\ttft3\Zotero\storage\AHNLSK6G\texas-floods-missing-search.html","","","Abbott, Gregory W (1957- ); Camp Mystic (Hunt, Tex); Camps and Camping; Kerr County (Tex); Texas","","","","","","","","","","","","","","","","","","","","","","","","","","","","","","","","","","","","","","","","","","U.S.","","","",""
"56R2A524","preprint","2025","Cairo, Hannah","A Counterexample to the Mizohata-Takeuchi Conjecture","","","","10.48550/arXiv.2502.06137","http://arxiv.org/abs/2502.06137","We derive a family of $L^p$ estimates of the X-Ray transform of positive measures in $\mathbb R^d$, which we use to construct a $\log R$-loss counterexample to the Mizohata-Takeuchi conjecture for every $C^2$ hypersurface in $\mathbb R^d$ that does not lie in a hyperplane. In particular, multilinear restriction estimates at the endpoint cannot be sharpened directly by the Mizohata-Takeuchi conjecture.","2025-03-12","2025-07-09 00:53:51","2025-07-09 00:53:51","2025-07-09 00:53:51","","","","","","","","","","","","arXiv","","","","","","","arXiv.org","","arXiv:2502.06137 [math]","","C:\Users\ttft3\Zotero\storage\Z8LCG4Y9\Cairo - 2025 - A Counterexample to the Mizohata-Takeuchi Conjecture.pdf; C:\Users\ttft3\Zotero\storage\IX4XCF6X\2502.html","","","Mathematics - Classical Analysis and ODEs","","","","","","","","","","","","","","","","","","","arXiv:2502.06137","","","","","","","","","","","","","","","","","","","","","","","","","","",""
"3HYH4DNQ","preprint","2025","DeepSeek-AI; Guo, Daya; Yang, Dejian; Zhang, Haowei; Song, Junxiao; Zhang, Ruoyu; Xu, Runxin; Zhu, Qihao; Ma, Shirong; Wang, Peiyi; Bi, Xiao; Zhang, Xiaokang; Yu, Xingkai; Wu, Yu; Wu, Z. F.; Gou, Zhibin; Shao, Zhihong; Li, Zhuoshu; Gao, Ziyi; Liu, Aixin; Xue, Bing; Wang, Bingxuan; Wu, Bochao; Feng, Bei; Lu, Chengda; Zhao, Chenggang; Deng, Chengqi; Zhang, Chenyu; Ruan, Chong; Dai, Damai; Chen, Deli; Ji, Dongjie; Li, Erhang; Lin, Fangyun; Dai, Fucong; Luo, Fuli; Hao, Guangbo; Chen, Guanting; Li, Guowei; Zhang, H.; Bao, Han; Xu, Hanwei; Wang, Haocheng; Ding, Honghui; Xin, Huajian; Gao, Huazuo; Qu, Hui; Li, Hui; Guo, Jianzhong; Li, Jiashi; Wang, Jiawei; Chen, Jingchang; Yuan, Jingyang; Qiu, Junjie; Li, Junlong; Cai, J. L.; Ni, Jiaqi; Liang, Jian; Chen, Jin; Dong, Kai; Hu, Kai; Gao, Kaige; Guan, Kang; Huang, Kexin; Yu, Kuai; Wang, Lean; Zhang, Lecong; Zhao, Liang; Wang, Litong; Zhang, Liyue; Xu, Lei; Xia, Leyi; Zhang, Mingchuan; Zhang, Minghua; Tang, Minghui; Li, Meng; Wang, Miaojun; Li, Mingming; Tian, Ning; Huang, Panpan; Zhang, Peng; Wang, Qiancheng; Chen, Qinyu; Du, Qiushi; Ge, Ruiqi; Zhang, Ruisong; Pan, Ruizhe; Wang, Runji; Chen, R. J.; Jin, R. L.; Chen, Ruyi; Lu, Shanghao; Zhou, Shangyan; Chen, Shanhuang; Ye, Shengfeng; Wang, Shiyu; Yu, Shuiping; Zhou, Shunfeng; Pan, Shuting; Li, S. S.; Zhou, Shuang; Wu, Shaoqing; Ye, Shengfeng; Yun, Tao; Pei, Tian; Sun, Tianyu; Wang, T.; Zeng, Wangding; Zhao, Wanjia; Liu, Wen; Liang, Wenfeng; Gao, Wenjun; Yu, Wenqin; Zhang, Wentao; Xiao, W. L.; An, Wei; Liu, Xiaodong; Wang, Xiaohan; Chen, Xiaokang; Nie, Xiaotao; Cheng, Xin; Liu, Xin; Xie, Xin; Liu, Xingchao; Yang, Xinyu; Li, Xinyuan; Su, Xuecheng; Lin, Xuheng; Li, X. Q.; Jin, Xiangyue; Shen, Xiaojin; Chen, Xiaosha; Sun, Xiaowen; Wang, Xiaoxiang; Song, Xinnan; Zhou, Xinyi; Wang, Xianzu; Shan, Xinxia; Li, Y. K.; Wang, Y. Q.; Wei, Y. X.; Zhang, Yang; Xu, Yanhong; Li, Yao; Zhao, Yao; Sun, Yaofeng; Wang, Yaohui; Yu, Yi; Zhang, Yichao; Shi, Yifan; Xiong, Yiliang; He, Ying; Piao, Yishi; Wang, Yisong; Tan, Yixuan; Ma, Yiyang; Liu, Yiyuan; Guo, Yongqiang; Ou, Yuan; Wang, Yuduan; Gong, Yue; Zou, Yuheng; He, Yujia; Xiong, Yunfan; Luo, Yuxiang; You, Yuxiang; Liu, Yuxuan; Zhou, Yuyang; Zhu, Y. X.; Xu, Yanhong; Huang, Yanping; Li, Yaohui; Zheng, Yi; Zhu, Yuchen; Ma, Yunxian; Tang, Ying; Zha, Yukun; Yan, Yuting; Ren, Z. Z.; Ren, Zehui; Sha, Zhangli; Fu, Zhe; Xu, Zhean; Xie, Zhenda; Zhang, Zhengyan; Hao, Zhewen; Ma, Zhicheng; Yan, Zhigang; Wu, Zhiyu; Gu, Zihui; Zhu, Zijia; Liu, Zijun; Li, Zilin; Xie, Ziwei; Song, Ziyang; Pan, Zizheng; Huang, Zhen; Xu, Zhipeng; Zhang, Zhongyu; Zhang, Zhen","DeepSeek-R1: Incentivizing Reasoning Capability in LLMs via Reinforcement Learning","","","","10.48550/arXiv.2501.12948","http://arxiv.org/abs/2501.12948","We introduce our first-generation reasoning models, DeepSeek-R1-Zero and DeepSeek-R1. DeepSeek-R1-Zero, a model trained via large-scale reinforcement learning (RL) without supervised fine-tuning (SFT) as a preliminary step, demonstrates remarkable reasoning capabilities. Through RL, DeepSeek-R1-Zero naturally emerges with numerous powerful and intriguing reasoning behaviors. However, it encounters challenges such as poor readability, and language mixing. To address these issues and further enhance reasoning performance, we introduce DeepSeek-R1, which incorporates multi-stage training and cold-start data before RL. DeepSeek-R1 achieves performance comparable to OpenAI-o1-1217 on reasoning tasks. To support the research community, we open-source DeepSeek-R1-Zero, DeepSeek-R1, and six dense models (1.5B, 7B, 8B, 14B, 32B, 70B) distilled from DeepSeek-R1 based on Qwen and Llama.","2025-01-22","2025-07-12 07:33:57","2025-07-12 07:33:57","2025-07-12 07:33:57","","","","","","","DeepSeek-R1","","","","","arXiv","","","","","","","arXiv.org","","arXiv:2501.12948 [cs]","","C:\Users\ttft3\Zotero\storage\N8A64YMW\DeepSeek-AI 等 - 2025 - DeepSeek-R1 Incentivizing Reasoning Capability in LLMs via Reinforcement Learning.pdf; C:\Users\ttft3\Zotero\storage\RA5XCX6I\2501.html","","","Computer Science - Computation and Language; Computer Science - Machine Learning; Computer Science - Artificial Intelligence","","","","","","","","","","","","","","","","","","","arXiv:2501.12948","","","","","","","","","","","","","","","","","","","","","","","","","","",""
"M9QYPWJY","journalArticle","","Luhnow, David; Thomas, Matthew; Colchester, Max","China Reins In Belt and Road","","","","","","","","2025-07-15 16:18:00","2025-07-15 16:18:00","","","","","","","","","","","","","","","en","","","","","Zotero","","","","C:\Users\ttft3\Zotero\storage\8M6NT2RJ\Luhnow 等 - China Reins In Belt and Road.pdf","","","","","","","","","","","","","","","","","","","","","","","","","","","","","","","","","","","","","","","","","","","","","","","","",""
"UB2DGLK7","webpage","","","Roe v. Wade","Oyez","","","","https://www.oyez.org/cases/1971/70-18","A case in which the Court struck down several Texas laws that criminalized abortion, holding that laws that impose an undue burden on a woman’s right to seek an abortion violate her fundamental right to privacy under the Due Process Clause of the Fourteenth Amendment.","","2025-07-15 16:22:13","2025-07-15 16:22:13","2025-07-15 16:22:13","","","","","","","","","","","","","","en","","","","","","","","","C:\Users\ttft3\Zotero\storage\7TX98HBZ\70-18.html","","","","","","","","","","","","","","","","","","","","","","","","","","","","","","","","","","","","","","","","","","","","","","","","",""
"82PP4DHQ","webpage","","","From Indonesia to Nepal, anime pirate flag has become symbol of Asian Gen Z’s discontent | The Straits Times","","","","","https://www.straitstimes.com/asia/se-asia/from-indonesia-to-nepal-anime-pirate-flag-has-become-symbol-of-asian-gen-zs-discontent","","","2025-09-15 03:51:23","2025-09-15 03:51:23","2025-09-15 03:51:23","","","","","","","","","","","","","","","","","","","","","","","C:\Users\ttft3\Zotero\storage\2PEZ6A5T\from-indonesia-to-nepal-anime-pirate-flag-has-become-symbol-of-asian-gen-zs-discontent.html","","","","","","","","","","","","","","","","","","","","","","","","","","","","","","","","","","","","","","","","","","","","","","","","",""
"WZVJNRNM","webpage","2025","Ravid, Barak","U.S. enters Israel's war against Iran","Axios","","","","https://www.axios.com/2025/06/21/us-strike-iran-nuclear-israel-trump","Trump's direct intervention marks a historic escalation in the Middle East.","2025-06-22","2025-09-12 08:32:23","2025-09-12 08:32:23","2025-09-12 08:32:23","","","","","","","","","","","","","","en","","","","","","","","","C:\Users\ttft3\Zotero\storage\QSZV84MR\us-strike-iran-nuclear-israel-trump.html","","","","","","","","","","","","","","","","","","","","","","","","","","","","","","","","","","","","","","","","","","","","","","","","",""
