"QMKBGD8G","webpage","","","Trump set to grant another extension to avoid TikTok disruption","","","","","https://www.nbcnews.com/news/us-news/trump-extension-tiktok-rcna213625","","","2025-09-12 08:31:38","2025-09-12 08:31:38","2025-09-12 08:31:38","","","","","","","","","","","","","","","","","","","","","","","C:\Users\ttft3\Zotero\storage\Y7S2A55S\trump-extension-tiktok-rcna213625.html","","","","","","","","","","","","","","","","","","","","","","","","","","","","","","","","","","","","","","","","","","","","","","","","",""
"2ZGEDMYB","webpage","","","Israel strikes Iran despite Trump's nuclear deal hopes","","","","","https://www.axios.com/2025/06/13/israel-strike-iran-trump-nuclear-talks","","","2025-09-12 08:31:12","2025-09-12 08:31:12","2025-09-12 08:31:12","","","","","","","","","","","","","","","","","","","","","","","C:\Users\ttft3\Zotero\storage\EPMMBT48\israel-strike-iran-trump-nuclear-talks.html","","","","","","","","","","","","","","","","","","","","","","","","","","","","","","","","","","","","","","","","","","","","","","","","",""
"JIYY2HKT","webpage","2025","Eudaily, Lora Kolodny,Chris","Tesla loses $152 billion in market cap after Musk-Trump spat, biggest hit ever","CNBC","","","","https://www.cnbc.com/2025/06/05/tesla-shares-musk-trump.html","The drop comes as shares of the EV maker saw a 22% rally in May with Musk wrapping up his time as head of Trump's Department of Government Efficiency, or DOGE.","2025-06-05","2025-09-12 08:30:49","2025-09-12 08:30:49","2025-09-12 08:30:49","","","","","","","","","","","","","","en","","","","","","","Section: Technology","","C:\Users\ttft3\Zotero\storage\QGWH9A7Q\tesla-shares-musk-trump.html","","","","","","","","","","","","","","","","","","","","","","","","","","","","","","","","","","","","","","","","","","","","","","","","",""
"FGGDZAHW","newspaperArticle","2025","Luscombe, Richard","After crafting quiet Florida life, Shah of Iran’s alleged ‘chief torturer’ must now face trial","The Guardian","","0261-3077","","https://www.theguardian.com/world/2025/sep/11/parviz-sabeti-shah-iran-lawsuit","Parviz Sabeti crafted an anonymous new life for his family – but now he faces a $225m lawsuit for atrocities committed in prisons in Tehran and elsewhere","2025-09-11","2025-09-12 08:30:23","2025-09-12 08:30:23","2025-09-12 08:30:23","","","","","","","","","","","","","","en-GB","","","","","The Guardian","","","","C:\Users\ttft3\Zotero\storage\VR74TIGW\parviz-sabeti-shah-iran-lawsuit.html","","","Florida; Iran; Middle East and north Africa; Torture; US news; World news","","","","","","","","","","","","","","","","","","","","","","","","","","","","","","","","","","","","","","","","","","World news","","","",""
"CUBTD9MD","webpage","2025","Jie, Vinay Dwivedi,Lim Hui","India says it carried out military strikes against Pakistan as tensions spiral after Kashmir killings","CNBC","","","","https://www.cnbc.com/2025/05/07/india-says-it-carried-out-targeted-military-strikes-against-pakistan-.html","The operation follows a militant attack in Pahalgam, Jammu and Kashmir, in which 26 people were killed last month.","2025-05-06","2025-09-12 08:29:49","2025-09-12 08:29:49","2025-09-12 08:29:49","","","","","","","","","","","","","","en","","","","","","","Section: Defense","","C:\Users\ttft3\Zotero\storage\GN5PWKC5\india-says-it-carried-out-targeted-military-strikes-against-pakistan-.html","","","","","","","","","","","","","","","","","","","","","","","","","","","","","","","","","","","","","","","","","","","","","","","","",""
"95CACFNC","webpage","","","Here's how Trump calculated tariffs. The math has baffled economists - CNA","","","","","https://www.channelnewsasia.com/world/trump-tariffs-calculation-formula-5043991","","","2025-09-12 08:25:35","2025-09-12 08:25:35","2025-09-12 08:25:35","","","","","","","","","","","","","","","","","","","","","","","C:\Users\ttft3\Zotero\storage\8MBW66AD\trump-tariffs-calculation-formula-5043991.html","","","","","","","","","","","","","","","","","","","","","","","","","","","","","","","","","","","","","","","","","","","","","","","","",""
"X4WEHHQ7","blogPost","2025","Fortinsky, Sarah","Google officially updates name of 'Gulf of America' from Gulf of Mexico","The Hill","","","","https://thehill.com/policy/technology/5137409-google-officially-updates-name-of-gulf-of-america/","Google Maps users in the U.S. will now see “Gulf of America” displayed over the body of water that was once labeled the “Gulf of Mexico.” Users in Mexico will still see the name “Gulf of Mexico,” a…","2025-02-11","2025-09-12 08:25:00","2025-09-12 08:25:00","2025-09-12 08:25:00","","","","","","","","","","","","","","en-US","","Text","","","","","","","C:\Users\ttft3\Zotero\storage\9Y2QA3RC\5137409-google-officially-updates-name-of-gulf-of-america.html","","","","","","","","","","","","","","","","","","","","","","","","","","","","","","","","","","","","","","","","","","","","","","","","",""
"W2BELCQL","newspaperArticle","2024","Bland, Archie","Tuesday briefing: What happened when the doors of Syria’s most notorious prison were finally opened","The Guardian","","0261-3077","","https://www.theguardian.com/world/2024/dec/10/tuesday-briefing-what-happened-when-the-doors-of-syrias-most-notorious-prison-were-finally-opened","In today’s newsletter: The Guardian’s William Christou was the first western journalist to gain access to Sednaya prison. He reflects on what he saw","2024-12-10","2025-09-12 08:24:23","2025-09-12 08:24:23","2025-09-12 08:24:23","","","","","","","Tuesday briefing","","","","","","","en-GB","","","","","The Guardian","","","","C:\Users\ttft3\Zotero\storage\DFFXPDI9\tuesday-briefing-what-happened-when-the-doors-of-syrias-most-notorious-prison-were-finally-open.html","","","Middle East and north Africa; World news; Bashar al-Assad; Middle East; Syria; Weather","","","","","","","","","","","","","","","","","","","","","","","","","","","","","","","","","","","","","","","","","","World news","","","",""